{
  "catalog_snapshot_id": "sha256:5ee87e0287642c2c1ed75f34bc8a9a925e1bbc0c2ea668cce2ca89abe54481d7",
  "generated_at": "2026-10-09T01:47:27+00:00",
  "policy_digest": "c7d2ba0470739c5319ca4011fa2abb8739551fe01beae2113365a3f26ef5f4e2",
  "policy_id": "shadow-category-quartile.v1",
  "record_count": 28,
  "records": [
    {
      "asset_id": "agent-alpha-portfolio-guardian",
      "category": "09",
      "core": 80.79,
      "group": "agent:09",
      "group_size": 12,
      "kind": "agent",
      "rank": 1,
      "score_record_sha256": "4afb3bdb0a2a2eb99d75a72d4bf9c92981613024ed07dc3073d06ebab07c7125",
      "source_publication": "publication.v12.13.on-demand"
    },
    {
      "asset_id": "agent-correlation-break-research",
      "category": "09",
      "core": 76.49,
      "group": "agent:09",
      "group_size": 12,
      "kind": "agent",
      "rank": 2,
      "score_record_sha256": "902f3aae3011f6679d6ee384e512352679de458e918fae56bd486cc4445f27fd",
      "source_publication": "publication.v12.13"
    },
    {
      "asset_id": "agent-corporate-governance-scanner",
      "category": "09",
      "core": 76.32,
      "group": "agent:09",
      "group_size": 12,
      "kind": "agent",
      "rank": 3,
      "score_record_sha256": "40621f15d56c0ad680d988b9fdff0c2ef03a5ba92a0fae70ee31312d2e41241d",
      "source_publication": "publication.v12.13.on-demand"
    },
    {
      "asset_id": "skill-corporate-action-adjustment-auditor",
      "category": "01",
      "core": 80.82,
      "group": "skill:01",
      "group_size": 3,
      "kind": "skill",
      "rank": 1,
      "score_record_sha256": "a8a501ca39a19b293e62ee114b2bc73ce24a416833adb1c4f20e715eb92c8130",
      "source_publication": "publication.v12.13"
    },
    {
      "asset_id": "skill-factor-orthogonalize",
      "category": "02",
      "core": 76.07,
      "group": "skill:02",
      "group_size": 5,
      "kind": "skill",
      "rank": 1,
      "score_record_sha256": "24fc92a0e3af9c405e48abb8a5f05ee43612ecd6cdf6e7a86116a6362cb1572d",
      "source_publication": "publication.v12.13"
    },
    {
      "asset_id": "skill-factor-mining-pandaai",
      "category": "02",
      "core": 75.42,
      "group": "skill:02",
      "group_size": 5,
      "kind": "skill",
      "rank": 2,
      "score_record_sha256": "e29294244947493bf3ef1831eac4df83829e90be205bd2b6ba0b6d48d86fac8a",
      "source_publication": "publication.v12.13"
    },
    {
      "asset_id": "skill-ag-futures-seasonality",
      "category": "03",
      "core": 80.73,
      "group": "skill:03",
      "group_size": 38,
      "kind": "skill",
      "rank": 1,
      "score_record_sha256": "3bf3fc0ee6b96bd7d3e2d0a47283776cf6902f888b9f27c87d3806af237f828b",
      "source_publication": "publication.v12.13"
    },
    {
      "asset_id": "skill-futures-hedgecraft",
      "category": "03",
      "core": 79.7,
      "group": "skill:03",
      "group_size": 38,
      "kind": "skill",
      "rank": 2,
      "score_record_sha256": "a7e3f0d4f4bd954791de532a29a720b1de18dd14187ba17f14413f8bf533da32",
      "source_publication": "publication.v12.13"
    },
    {
      "asset_id": "skill-post-market-screener",
      "category": "03",
      "core": 79.11,
      "group": "skill:03",
      "group_size": 38,
      "kind": "skill",
      "rank": 3,
      "score_record_sha256": "2f016ecb06c5bd6756cc7d0db0137bb8280e17477d70bba4d36d666417098707",
      "source_publication": "publication.v12.13"
    },
    {
      "asset_id": "skill-global-commodity-term-structure",
      "category": "03",
      "core": 79.03,
      "group": "skill:03",
      "group_size": 38,
      "kind": "skill",
      "rank": 4,
      "score_record_sha256": "e8f5f267042ebef546fa841005ff88eb6bb8f3199efa86b11ec3295f731792eb",
      "source_publication": "publication.v12.13"
    },
    {
      "asset_id": "skill-stock-memory-analyzer-usa",
      "category": "03",
      "core": 78.78,
      "group": "skill:03",
      "group_size": 38,
      "kind": "skill",
      "rank": 5,
      "score_record_sha256": "4d411d58ef43e578292db96f4d4f5419c2d0f7cc2374b61b66aa1e0672db4057",
      "source_publication": "publication.v12.13"
    },
    {
      "asset_id": "skill-buffett-moat-screener-lavine-version",
      "category": "03",
      "core": 78.74,
      "group": "skill:03",
      "group_size": 38,
      "kind": "skill",
      "rank": 6,
      "score_record_sha256": "6fd5c82f1280bb46fe16a8a9e929ec3e0340de4d17737de362df52ada1dec16f",
      "source_publication": "publication.v12.13.on-demand"
    },
    {
      "asset_id": "skill-hk-us-consensus-revision-radar",
      "category": "03",
      "core": 78.72,
      "group": "skill:03",
      "group_size": 38,
      "kind": "skill",
      "rank": 7,
      "score_record_sha256": "1f0a7ea41243a23f42d88cf3db16425806363ff547a1cbeab7d0cea88212fff9",
      "source_publication": "publication.v12.13"
    },
    {
      "asset_id": "skill-option-strategy-builder",
      "category": "03",
      "core": 78.49,
      "group": "skill:03",
      "group_size": 38,
      "kind": "skill",
      "rank": 8,
      "score_record_sha256": "3c26d1a9d998cd1a751798ebed7bb02984c88885470f12c26f4acab916982135",
      "source_publication": "publication.v12.13"
    },
    {
      "asset_id": "skill-index-rebalance-event-study",
      "category": "03",
      "core": 78.35,
      "group": "skill:03",
      "group_size": 38,
      "kind": "skill",
      "rank": 9,
      "score_record_sha256": "c45f7fcb81bf37fa17aad36b0a9f3de54eab5c36c84f58fb4d323e0b2bac138a",
      "source_publication": "publication.v12.13"
    },
    {
      "asset_id": "skill-etf-fund-evaluator",
      "category": "03",
      "core": 78.3,
      "group": "skill:03",
      "group_size": 38,
      "kind": "skill",
      "rank": 10,
      "score_record_sha256": "436b54aea5b02e8447522787141497b7444aaacc0dba1052ec0e19bd9fbc45b0",
      "source_publication": "publication.v12.13"
    },
    {
      "asset_id": "skill-quant-portfolio-risk",
      "category": "04",
      "core": 75.71,
      "group": "skill:04",
      "group_size": 16,
      "kind": "skill",
      "rank": 1,
      "score_record_sha256": "0cd50ed3b322cd4eadf215ca4a71b0d8c694c30f1e7099dac56badc2c8acaa51",
      "source_publication": "publication.v12.13"
    },
    {
      "asset_id": "skill-capital-flow-crowding-monitor",
      "category": "04",
      "core": 74.97,
      "group": "skill:04",
      "group_size": 16,
      "kind": "skill",
      "rank": 2,
      "score_record_sha256": "29b0a96bec6d4fffdb73de4e56386634a225d3e9160488ab36ad13c350c5380f",
      "source_publication": "publication.v12.13"
    },
    {
      "asset_id": "skill-portfolio-liquidity-stress-test",
      "category": "04",
      "core": 73.93,
      "group": "skill:04",
      "group_size": 16,
      "kind": "skill",
      "rank": 3,
      "score_record_sha256": "004f8ef01bdaf2de89e0aa1f0e828fc366d122aa55e52049d7ac9cf89d35aea0",
      "source_publication": "publication.v12.13"
    },
    {
      "asset_id": "skill-a-share-market-risk-radar",
      "category": "04",
      "core": 73.27,
      "group": "skill:04",
      "group_size": 16,
      "kind": "skill",
      "rank": 4,
      "score_record_sha256": "25bc2f60b06e783fb6be567254af817697de2086cb818eb8eaeb8be974997e6b",
      "source_publication": "publication.v12.13"
    },
    {
      "asset_id": "skill-transaction-cost-calibration",
      "category": "05",
      "core": 80.51,
      "group": "skill:05",
      "group_size": 7,
      "kind": "skill",
      "rank": 1,
      "score_record_sha256": "8d79093e6f61654759906121049eda0952acf7d201eee9281a680e1cc77d2f98",
      "source_publication": "publication.v12.13"
    },
    {
      "asset_id": "skill-portfolio-optimize",
      "category": "05",
      "core": 75.26,
      "group": "skill:05",
      "group_size": 7,
      "kind": "skill",
      "rank": 2,
      "score_record_sha256": "929fe3366ccfafcc2b88c064460bf053573c1f5b1dcf312f3de8af1e7273677d",
      "source_publication": "publication.v12.13"
    },
    {
      "asset_id": "skill-x-trader-builder",
      "category": "06",
      "core": 79.5,
      "group": "skill:06",
      "group_size": 6,
      "kind": "skill",
      "rank": 1,
      "score_record_sha256": "4e3e4acf6c51738fc95294471cc5e355dd5904d33727fbe97209255b68fc8d47",
      "source_publication": "publication.v12.13"
    },
    {
      "asset_id": "skill-serenity-research-model",
      "category": "06",
      "core": 79.46,
      "group": "skill:06",
      "group_size": 6,
      "kind": "skill",
      "rank": 2,
      "score_record_sha256": "bc4a09548e96d8d94794c54090e21acb3da3f8a69a1b286806b8a5920f4c5699",
      "source_publication": "publication.v12.13"
    },
    {
      "asset_id": "skill-backtesting-bias-avoidance",
      "category": "07",
      "core": 74.23,
      "group": "skill:07",
      "group_size": 3,
      "kind": "skill",
      "rank": 1,
      "score_record_sha256": "b6336f05a853d72acd6911fec67979c7fd2a2a080920495d24cbf4b7556a614a",
      "source_publication": "publication.v12.13"
    },
    {
      "asset_id": "skill-earnings-event-study",
      "category": "08",
      "core": 79.36,
      "group": "skill:08",
      "group_size": 8,
      "kind": "skill",
      "rank": 1,
      "score_record_sha256": "aa810d8f219d82223772d2da1be916a6a96d627b20a2b7dd4097c90727c210c9",
      "source_publication": "publication.v12.13"
    },
    {
      "asset_id": "skill-disclosure-event-extractor",
      "category": "08",
      "core": 78.9,
      "group": "skill:08",
      "group_size": 8,
      "kind": "skill",
      "rank": 2,
      "score_record_sha256": "0f4cf4c5896f1ba3a958903c02aa3d88cf84738f34942cca643b1c382b761aca",
      "source_publication": "publication.v12.13"
    },
    {
      "asset_id": "skill-pandaai-workflow-generator",
      "category": "10",
      "core": 72.49,
      "group": "skill:10",
      "group_size": 2,
      "kind": "skill",
      "rank": 1,